{"account_id":"acct.paper.001","balanced":true,"created_at":"2026-09-05T00:00:00Z","ending_cash":"52480.00","fee_totals":{"borrow_financing":"0.00","brokerage_commissions":"0.00","exchange_fees":"14.20"},"ledger_schema_version":1,"period_end":"2026-09-04T23:59:59Z","period_start":"2026-09-01T00:00:00Z","realized_pnl":"2480.00","starting_cash":"50000.00","statement_id":"stmt.reconciliation.001","tax_lots":[{"acquired_at":"2026-09-02T14:35:00Z","cost_basis":"502.10","disposition":"OPEN","instrument_id":"inst.us_equity.spy","lot_id":"lot.spy.001","quantity":"100"}],"unrealized_pnl":"1030.00"}
